{
  "document_id": "email:5540",
  "document_type": "email",
  "document_revision": 1,
  "content_version": "sha256:35e6ed52f1a815f9b48e99fe3a86fe0b7456b0a5b617a87ca15915ae33e8c55b",
  "source_instance_id": "dev-synthetic",
  "generation": "3f6c9a1e-5b2d-4c8e-9f10-2a3b4c5d6e7f",
  "url": "/email/message/5540/",
  "mailbox": {
    "id": 1,
    "address": "sales@minerva.example"
  },
  "thread": null,
  "message_id": "<5540@client.example>",
  "in_reply_to": "",
  "direction": "internal",
  "category": "internal",
  "sent_at": "2026-10-02T09:00:00Z",
  "subject": "Fwd: stock check",
  "from": {
    "email": "colleague@minerva.example",
    "name": "Colleague"
  },
  "to": [
    "sales@minerva.example"
  ],
  "cc": [],
  "text": "Internal note: check stock before replying.",
  "text_truncated": false,
  "text_new": "Internal note: check stock before replying.",
  "text_new_mode": "full",
  "text_new_truncated": false,
  "customer": null,
  "projects": [],
  "orders": [],
  "attachments": [],
  "access": {
    "scope": "mailbox",
    "mailbox_id": 1,
    "user_ids": [
      1
    ]
  },
  "updated_at": "2026-10-20T08:15:02Z"
}
